,level_0,index,Index,item_id,seller_id,listing_title,listing_description,listing_price,category_sk,category_l1_name_en,category_l2_name_en,category_l3_name_en,Final_Area,Key
217,216,17395,17397,17396,2201,"Snuza Sound, video and movement monitor","Please send a sms, whatâs app or email during office hours

Calls are welcome after hours (5 pm to 9 pm)

Item can be collected in Die Wilgers, Pretoria East after 6 pm during the week or on a Saturday between 10 am and 3 pm

I donât deliver, post or c",950.0,olx|mea|za|853|856,Kids & Baby,"Prams, Cots & Equipment",Unknown, City of Tshwane Metropolitan Municipality,"Prams, Cots & Equipment :  City of Tshwane Metropolitan Municipality"
218,218,17442,17444,17443,2696,Graco signature series travel system,Graco signature travel system in red with car seat,2200.0,olx|mea|za|853|856,Kids & Baby,"Prams, Cots & Equipment",Unknown, City of Tshwane Metropolitan Municipality,"Prams, Cots & Equipment :  City of Tshwane Metropolitan Municipality"
219,223,17697,17699,17698,13989,Avent electric bottle sterilizer,"Avent - Digital Steriliser 3-in-1 
The easiest way to sterilise. Adjustable Avent steriliser saves space. Our new Avent electric steam steriliser has been designed to make sterilising as simple as possible. With adjustable size, it takes up less kitchen sp",1000.0,olx|mea|za|853|856,Kids & Baby,"Prams, Cots & Equipment",Unknown, City of Tshwane Metropolitan Municipality,"Prams, Cots & Equipment :  City of Tshwane Metropolitan Municipality"
220,225,17798,17800,17799,14062,Play gym,Safari play gym. As good as new. Machine washable.,250.0,olx|mea|za|853|856,Kids & Baby,"Prams, Cots & Equipment",Unknown, City of Tshwane Metropolitan Municipality,"Prams, Cots & Equipment :  City of Tshwane Metropolitan Municipality"
221,229,18174,18176,18175,14311,Tiny Love Cot Mobile,Tiny love Cot Mobile with movement and sounds,600.0,olx|mea|za|853|856,Kids & Baby,"Prams, Cots & Equipment",Unknown, City of Tshwane Metropolitan Municipality,"Prams, Cots & Equipment :  City of Tshwane Metropolitan Municipality"
222,233,18451,18453,18452,14484,Wooden sleigh cot,Wooden sleigh cot for sale - practically brand new!!,5000.0,olx|mea|za|853|856,Kids & Baby,"Prams, Cots & Equipment",Unknown, City of Tshwane Metropolitan Municipality,"Prams, Cots & Equipment :  City of Tshwane Metropolitan Municipality"
223,239,18887,18889,18888,14787,Baby feeding chair,"navy blue baby feeding chair ,hooks steadily onto dinner table,never been used.Easy to store and travel with.",100.0,olx|mea|za|853|856,Kids & Baby,"Prams, Cots & Equipment",Unknown, City of Tshwane Metropolitan Municipality,"Prams, Cots & Equipment :  City of Tshwane Metropolitan Municipality"
224,244,19471,19473,19472,15184,Camping cot,Camping cot excl matress incl manual breastpump set,550.0,olx|mea|za|853|856,Kids & Baby,"Prams, Cots & Equipment",Unknown, City of Tshwane Metropolitan Municipality,"Prams, Cots & Equipment :  City of Tshwane Metropolitan Municipality"
225,245,19654,19656,19655,5779,Girls Shoes For Sale Size 8,"NO TIME WAISTERS.
Still in very good condition, washed and clean,brands from Walkmates, funmates, lollypop and Ackermans. 9x pairs in bag.

PLEASE ONLY WHATSUP DURING OFFICE HOURS CAN'T ANSWER PERSONAL CALLS AT WORK",400.0,olx|mea|za|853|855,Kids & Baby,Toddler's Clothing & Accessories,Unknown, City of Tshwane Metropolitan Municipality,Toddler's Clothing & Accessories :  City of Tshwane Metropolitan Municipality
226,264,21343,21345,21344,16448,Baby pouch,Baby sling pouch carrier R250,250.0,olx|mea|za|853|856,Kids & Baby,"Prams, Cots & Equipment",Unknown, City of Tshwane Metropolitan Municipality,"Prams, Cots & Equipment :  City of Tshwane Metropolitan Municipality"
227,266,21358,21360,21359,16461,Lindan bounce about,Lindam bounce about good condition,200.0,olx|mea|za|853|856,Kids & Baby,"Prams, Cots & Equipment",Unknown, City of Tshwane Metropolitan Municipality,"Prams, Cots & Equipment :  City of Tshwane Metropolitan Municipality"
228,274,21596,21598,21597,16621,3 Weeler Chelino pram and carrier with camping cot,3 weeler chelino pram with its carrier in good condition. called a joging pram for its comfart and easy to use any where. has a few scratches at the bottom nothing much. and a camping cot the cot is in working condution but coulor is faded. if you take bot,1000.0,olx|mea|za|853|856,Kids & Baby,"Prams, Cots & Equipment",Unknown, City of Tshwane Metropolitan Municipality,"Prams, Cots & Equipment :  City of Tshwane Metropolitan Municipality"
229,279,21860,21862,21861,16794,Tommee Tippee electric breast pump,Tommee Tippee electric breast pump te koop met 5 ekstra storage cups.een keer probeer gebruik en besluit op formula,800.0,olx|mea|za|853|856,Kids & Baby,"Prams, Cots & Equipment",Unknown, City of Tshwane Metropolitan Municipality,"Prams, Cots & Equipment :  City of Tshwane Metropolitan Municipality"
230,282,22048,22050,22049,16918,Safeway car seat,Moto x5 Safeway car seat in good condition,250.0,olx|mea|za|853|856,Kids & Baby,"Prams, Cots & Equipment",Unknown, City of Tshwane Metropolitan Municipality,"Prams, Cots & Equipment :  City of Tshwane Metropolitan Municipality"
231,286,22528,22530,22529,17211,Pram & car seat,"Chelino Pram & Car Seat, you can fold pram in one hand",1000.0,olx|mea|za|853|856,Kids & Baby,"Prams, Cots & Equipment",Unknown, City of Tshwane Metropolitan Municipality,"Prams, Cots & Equipment :  City of Tshwane Metropolitan Municipality"
232,310,24674,24676,24675,18550,Angelcare Movement and Sound Baby Monitor,Opened but not used Angelcare movement and sound monitor. It was a duplicate gift. Return if not satisfied within 7 days.,700.0,olx|mea|za|853|856,Kids & Baby,"Prams, Cots & Equipment",Unknown, City of Tshwane Metropolitan Municipality,"Prams, Cots & Equipment :  City of Tshwane Metropolitan Municipality"
233,311,24840,24842,24841,18648,New all All Star Converse leather,New all star Converse. Sizes 10:5. This are very small for my Son. Still in Original package with the till slip. I need to sell or exchage to get him bigger size.,350.0,olx|mea|za|853|855,Kids & Baby,Toddler's Clothing & Accessories,Unknown, City of Tshwane Metropolitan Municipality,Toddler's Clothing & Accessories :  City of Tshwane Metropolitan Municipality
234,312,24908,24910,24909,18682,Fetal heart detector,Works 100%,300.0,olx|mea|za|853|856,Kids & Baby,"Prams, Cots & Equipment",Unknown, City of Tshwane Metropolitan Municipality,"Prams, Cots & Equipment :  City of Tshwane Metropolitan Municipality"
235,322,25500,25502,25501,19068,Spiderman curtains x 3 plus 2 scatter cushions,Three standard spiderman Marval Kids polyesters curtains and twee scatter cushions.,450.0,olx|mea|za|853|855,Kids & Baby,Toddler's Clothing & Accessories,Unknown, City of Tshwane Metropolitan Municipality,Toddler's Clothing & Accessories :  City of Tshwane Metropolitan Municipality
236,326,25741,25743,25742,19245,car bed for sale,Car bed still in good condestion must come and pick him up,2000.0,olx|mea|za|853|856,Kids & Baby,"Prams, Cots & Equipment",Unknown, City of Tshwane Metropolitan Municipality,"Prams, Cots & Equipment :  City of Tshwane Metropolitan Municipality"
237,328,25780,25782,25781,14917,Baby monitor,"UK baby monitor with adaptors for SA. Tall to baby function, sound and lights.",250.0,olx|mea|za|853|856,Kids & Baby,"Prams, Cots & Equipment",Unknown, City of Tshwane Metropolitan Municipality,"Prams, Cots & Equipment :  City of Tshwane Metropolitan Municipality"
238,329,26141,26143,26142,19494,baby chest of draws,"Baby 4 draw 1 door chest of draws 
1.2 m L x 1 m H x 45cm D
Available in a variety of colors 
Direct from factory shop to you 
Wide rage of furniture in store 

Furniture Factory Shop
116 Ellman street 
Sunderland ridge 
Centurion 
Pretoria 
0826261414",1699.0,olx|mea|za|853|856,Kids & Baby,"Prams, Cots & Equipment",Unknown, City of Tshwane Metropolitan Municipality,"Prams, Cots & Equipment :  City of Tshwane Metropolitan Municipality"
239,332,26574,26576,26575,19763,Baby high chair for sale,Baby high chair for sale.,400.0,olx|mea|za|853|856,Kids & Baby,"Prams, Cots & Equipment",Unknown, City of Tshwane Metropolitan Municipality,"Prams, Cots & Equipment :  City of Tshwane Metropolitan Municipality"
240,340,26982,26984,26983,20033,Stroller,Baby stroller - folds up similar to an umbrella,300.0,olx|mea|za|853|856,Kids & Baby,"Prams, Cots & Equipment",Unknown, City of Tshwane Metropolitan Municipality,"Prams, Cots & Equipment :  City of Tshwane Metropolitan Municipality"
241,348,27985,27987,27986,20673,Girl/ Boy Mamas & Papas pram for sale,Used and in good condition Mamas & Papas (Sola) pram. Unisex in colour (aubergine) with orange & green âtreeâ fabric.  Can be reversed to forward facing so that you can see your baby.  Front & rear suspension. Adjustable handle. Lie flat seat.  Lockabl,2000.0,olx|mea|za|853|856,Kids & Baby,"Prams, Cots & Equipment",Unknown, City of Tshwane Metropolitan Municipality,"Prams, Cots & Equipment :  City of Tshwane Metropolitan Municipality"
242,363,29611,29613,29612,21658,Baby Car Seat (Safeway),"â¢ Very Good Condition Car Seat
â¢ Clean
â¢ Well Maintained",500.0,olx|mea|za|853|856,Kids & Baby,"Prams, Cots & Equipment",Unknown, City of Tshwane Metropolitan Municipality,"Prams, Cots & Equipment :  City of Tshwane Metropolitan Municipality"
243,369,29838,29840,29839,21797,Swaai vir kinders,Swaai vir kinders,300.0,olx|mea|za|853|856,Kids & Baby,"Prams, Cots & Equipment",Unknown, City of Tshwane Metropolitan Municipality,"Prams, Cots & Equipment :  City of Tshwane Metropolitan Municipality"
244,371,29859,29861,29860,21808,Graco pack and play camping cot,Camping cot with pack and play kit,1800.0,olx|mea|za|853|856,Kids & Baby,"Prams, Cots & Equipment",Unknown, City of Tshwane Metropolitan Municipality,"Prams, Cots & Equipment :  City of Tshwane Metropolitan Municipality"
245,374,30176,30178,30177,21986,Little me 3 wheeler pram for R800,Little me gray and blue 3 wheeler pram for R800,800.0,olx|mea|za|853|856,Kids & Baby,"Prams, Cots & Equipment",Unknown, City of Tshwane Metropolitan Municipality,"Prams, Cots & Equipment :  City of Tshwane Metropolitan Municipality"
246,385,30671,30673,30672,22267,Stokke Xplory in Blue,"We are selling this amazing Stokke Xplory in excellent condition . It comes from a non - smoking home and has been very well looked after. This is a very attractive travel system that will be suitable from birth. 

This is listed as collection only so pl",14000.0,olx|mea|za|853|856,Kids & Baby,"Prams, Cots & Equipment",Unknown, City of Tshwane Metropolitan Municipality,"Prams, Cots & Equipment :  City of Tshwane Metropolitan Municipality"
247,396,31199,31201,31200,22565,Wooden Baby Cot,"Im selling a wooden baby cot, with matress, barely used. Price is negotiable.",1200.0,olx|mea|za|853|856,Kids & Baby,"Prams, Cots & Equipment",Unknown, City of Tshwane Metropolitan Municipality,"Prams, Cots & Equipment :  City of Tshwane Metropolitan Municipality"
248,406,32099,32101,32100,23078,Baby carrier,Comfort in good shape never been used its clean for babies  from 0months,100.0,olx|mea|za|853|856,Kids & Baby,"Prams, Cots & Equipment",Unknown, City of Tshwane Metropolitan Municipality,"Prams, Cots & Equipment :  City of Tshwane Metropolitan Municipality"
249,414,32397,32399,32398,13458,Nania Car seat Booster,Car Booster from 3 years to 10 year olds. AVAILABLE FROM 20 JUNE 2017.,800.0,olx|mea|za|853|856,Kids & Baby,"Prams, Cots & Equipment",Unknown, City of Tshwane Metropolitan Municipality,"Prams, Cots & Equipment :  City of Tshwane Metropolitan Municipality"
250,419,32898,32900,32899,23537,Baba goed te koop,"Die bad 100rand,bambo stoeltjie 100rand, swart sak met baba seuntjie klere 150rand , eetstoeltjie word n tafeltjie en stoel 200rand,stoeltjie vir bad 50rand",600.0,olx|mea|za|853|855,Kids & Baby,Toddler's Clothing & Accessories,Unknown, City of Tshwane Metropolitan Municipality,Toddler's Clothing & Accessories :  City of Tshwane Metropolitan Municipality
251,446,34667,34669,34668,7012,Baby Name Numerology Services,"My name is Chris. I am an intuitive, spiritual guide and spiritual numerologist. As spiritual numerologist I have 15 (fifteen) years experience.

I have a blog that is running and I mostly keep in contact with all my clients through email and Whatsapp bo",144.0,olx|mea|za|853|856,Kids & Baby,"Prams, Cots & Equipment",Unknown, City of Tshwane Metropolitan Municipality,"Prams, Cots & Equipment :  City of Tshwane Metropolitan Municipality"
252,460,35493,35495,35494,25020,Grace Pram,Fairly good condition.Everyday pram.,1000.0,olx|mea|za|853|856,Kids & Baby,"Prams, Cots & Equipment",Unknown, City of Tshwane Metropolitan Municipality,"Prams, Cots & Equipment :  City of Tshwane Metropolitan Municipality"
253,468,35805,35807,35806,25209,Jeep baby carrier,Jeep carrier. Very good condition,300.0,olx|mea|za|853|856,Kids & Baby,"Prams, Cots & Equipment",Unknown, City of Tshwane Metropolitan Municipality,"Prams, Cots & Equipment :  City of Tshwane Metropolitan Municipality"
254,483,36709,36711,36710,25717,Feeding Comfort,Feeding Pillow,50.0,olx|mea|za|853|856,Kids & Baby,"Prams, Cots & Equipment",Unknown, City of Tshwane Metropolitan Municipality,"Prams, Cots & Equipment :  City of Tshwane Metropolitan Municipality"
255,485,36767,36769,36768,25753,Personalised Cot Bedding (Christiaan),"Personalised Cot Bedding for boy named Christiaan.  Standard cot size. Includes duvet cover, cushion cover, bumper cushion cover, 2 x brown fitted sheets, separate cushion with cover, changing station cover & nappy stack. Animal themed.

I also have a st",400.0,olx|mea|za|853|856,Kids & Baby,"Prams, Cots & Equipment",Unknown, City of Tshwane Metropolitan Municipality,"Prams, Cots & Equipment :  City of Tshwane Metropolitan Municipality"
256,489,37316,37318,37317,26058,Milton Sterilising Bucket,"Milton Sterilising Bucket 
Description: Sterilise baby bottles and teats.
Condition: Very good condition.
Region: Pretoria / Centurion
Price: R50",50.0,olx|mea|za|853|856,Kids & Baby,"Prams, Cots & Equipment",Unknown, City of Tshwane Metropolitan Municipality,"Prams, Cots & Equipment :  City of Tshwane Metropolitan Municipality"
257,493,37528,37530,37529,15727,Nike shoes,"Nike shoes for sale , size US 5c n UK 4.5 so u can come n collect at mabopane",250.0,olx|mea|za|853|855,Kids & Baby,Toddler's Clothing & Accessories,Unknown, City of Tshwane Metropolitan Municipality,Toddler's Clothing & Accessories :  City of Tshwane Metropolitan Municipality
258,494,37539,37541,37540,26176,Stokke izi sleep infant car seat,"Stage 0 infant car seat 0-13kg, rear facing, excellent condition, retails for R5300 used for a year",2000.0,olx|mea|za|853|856,Kids & Baby,"Prams, Cots & Equipment",Unknown, City of Tshwane Metropolitan Municipality,"Prams, Cots & Equipment :  City of Tshwane Metropolitan Municipality"
259,497,37602,37604,37603,26209,Chelino car seat,"Car seat for sale. Chelino.Â  15 - 36kg. Very good conditionÂ  
Contact du Plessis at Â  0721260136",700.0,olx|mea|za|853|856,Kids & Baby,"Prams, Cots & Equipment",Unknown, City of Tshwane Metropolitan Municipality,"Prams, Cots & Equipment :  City of Tshwane Metropolitan Municipality"
260,499,37727,37729,37728,26280,Camp cot,Foldable camp cot,300.0,olx|mea|za|853|856,Kids & Baby,"Prams, Cots & Equipment",Unknown, City of Tshwane Metropolitan Municipality,"Prams, Cots & Equipment :  City of Tshwane Metropolitan Municipality"
261,4,566,566,566,553,Angel care diaper bin,It a angel care  diaper dispenser bin,200.0,olx|mea|za|853|856,Kids & Baby,"Prams, Cots & Equipment",Unknown, City of Cape Town,"Prams, Cots & Equipment :  City of Cape Town"
262,6,852,852,852,831,Stokke Cot + Stokke Changer R12 500 immaculate!,"Stokke sleepi cot including stokke Changer all in immaculate condition!

Can be disassembled into small panels easily.
Call 0788631151 to view 

No scam emails will be entertained!!!",12500.0,olx|mea|za|853|856,Kids & Baby,"Prams, Cots & Equipment",Unknown, City of Cape Town,"Prams, Cots & Equipment :  City of Cape Town"
263,13,1446,1446,1446,1396,Children's Bedroom set from Treehouse,"Single bed with mattress, bedstand with toyboxes and bookshelf with picture frames in good condition all from Treehouse",3000.0,olx|mea|za|853|856,Kids & Baby,"Prams, Cots & Equipment",Unknown, City of Cape Town,"Prams, Cots & Equipment :  City of Cape Town"
264,30,2510,2510,2510,2361,Camp cot,"Camp cot in excellent condition, hardly used.",500.0,olx|mea|za|853|856,Kids & Baby,"Prams, Cots & Equipment",Unknown, City of Cape Town,"Prams, Cots & Equipment :  City of Cape Town"
265,34,2884,2884,2884,2693,playmat,"Baby playmat good condition R200
0799335169",200.0,olx|mea|za|853|856,Kids & Baby,"Prams, Cots & Equipment",Unknown, City of Cape Town,"Prams, Cots & Equipment :  City of Cape Town"
266,40,3229,3229,3229,2978,Chelino urban detour travel system,"Pram ,car seat with mosquito net & isofix base all in good condition.price not neg.!!! W.app 0727164730. Collect grassy park",2000.0,olx|mea|za|853|856,Kids & Baby,"Prams, Cots & Equipment",Unknown, City of Cape Town,"Prams, Cots & Equipment :  City of Cape Town"
267,51,4520,4520,4520,4086,Chelino Sports car seat,Chelino Sports car seat as good as new. Can recline. Up to 25kg. BARGAIN!!,690.0,olx|mea|za|853|856,Kids & Baby,"Prams, Cots & Equipment",Unknown, City of Cape Town,"Prams, Cots & Equipment :  City of Cape Town"
268,58,4848,4848,4848,4368,Graco camp cot,"Graco Camp cot includes matress,baby cleaning station and has 2 levels",749.0,olx|mea|za|853|856,Kids & Baby,"Prams, Cots & Equipment",Unknown, City of Cape Town,"Prams, Cots & Equipment :  City of Cape Town"
269,64,5254,5254,5254,927,Baby sleepsuits x 18,"1x (3 - 6 months), 10x (6 - 9 months), 6x (9 - 12 months), 1x (12 - 18 months). Beautiful condition",300.0,olx|mea|za|853|855,Kids & Baby,Toddler's Clothing & Accessories,Unknown, City of Cape Town,Toddler's Clothing & Accessories :  City of Cape Town
270,79,6344,6344,6344,5600,Car seats/booser seats,"In need of a car seat or Booster seat.
Come and have a look what we have on offer for a fraction of the cost.

Sms or watsapp for more information.",1234.0,olx|mea|za|853|856,Kids & Baby,"Prams, Cots & Equipment",Unknown, City of Cape Town,"Prams, Cots & Equipment :  City of Cape Town"
271,83,6833,6833,6833,5981,2 size 5 dresses from America in Excellent used condition,These dresses are perfect for any little girl. They are both from America and are great quality. They are in excellent used condition. Size is for age 5T. They are R70 each or R125 for both. From smoke free home.,70.0,olx|mea|za|853|855,Kids & Baby,Toddler's Clothing & Accessories,Unknown, City of Cape Town,Toddler's Clothing & Accessories :  City of Cape Town
272,87,6984,6984,6984,6103,Kiddies,3/4 add me on WhatsApp 0626922623,50.0,olx|mea|za|853|855,Kids & Baby,Toddler's Clothing & Accessories,Unknown, City of Cape Town,Toddler's Clothing & Accessories :  City of Cape Town
273,88,6996,6996,6996,6112,Car Seat for Sale,"Strong, versatile used car seat. About three years old. For 3-6 year olds. Can be detached into three sections for ease of use.",500.0,olx|mea|za|853|856,Kids & Baby,"Prams, Cots & Equipment",Unknown, City of Cape Town,"Prams, Cots & Equipment :  City of Cape Town"
274,97,7748,7748,7748,6722,Angelcare movement & sound baby monitor - excellent condition,Baby monitor,900.0,olx|mea|za|853|856,Kids & Baby,"Prams, Cots & Equipment",Unknown, City of Cape Town,"Prams, Cots & Equipment :  City of Cape Town"
275,99,7775,7775,7775,4522,2 good quality tab top pink curtains for sale,Good quality with lining. For viewing mail Sms/ whtsapp Susan,150.0,olx|mea|za|853|856,Kids & Baby,"Prams, Cots & Equipment",Unknown, City of Cape Town,"Prams, Cots & Equipment :  City of Cape Town"
276,101,8013,8013,8013,6931,Toddler levi dungree 12-18months,WhatsApp me0618076734 still in excellent condition,150.0,olx|mea|za|853|855,Kids & Baby,Toddler's Clothing & Accessories,Unknown, City of Cape Town,Toddler's Clothing & Accessories :  City of Cape Town
277,116,9347,9347,9347,7975,Winnie the pooh cot mobile,Brand new in a very good condition and barely used,350.0,olx|mea|za|853|856,Kids & Baby,"Prams, Cots & Equipment",Unknown, City of Cape Town,"Prams, Cots & Equipment :  City of Cape Town"
278,141,12134,12136,12135,10070,Bakugan themed rain boots (size 13),Orange Bakugan themed rain boots.  Size 13,40.0,olx|mea|za|853|855,Kids & Baby,Toddler's Clothing & Accessories,Unknown, City of Cape Town,Toddler's Clothing & Accessories :  City of Cape Town
279,142,12185,12187,12186,10109,Graco Ultima Plus Travel system. As new R2000 onco.,"All still in excellent working condition. With all excesories and books. Also a very warm sleeping bag that fits in the chair. See pics for details. 

Contact CJ on 084 602 8330. Also on WhatsApp.",2000.0,olx|mea|za|853|856,Kids & Baby,"Prams, Cots & Equipment",Unknown, City of Cape Town,"Prams, Cots & Equipment :  City of Cape Town"
280,144,12269,12271,12270,4064,superwood cot,White cot with two large drawers at the bottom with new mattress in good condition R2000 negotiable,2000.0,olx|mea|za|853|856,Kids & Baby,"Prams, Cots & Equipment",Unknown, City of Cape Town,"Prams, Cots & Equipment :  City of Cape Town"
281,194,15824,15826,15825,12698,Baby cot changer,Selling my unused Baby Cot Changer. Fits nicely on top of cot. Still in its original packaging.,400.0,olx|mea|za|853|856,Kids & Baby,"Prams, Cots & Equipment",Unknown, City of Cape Town,"Prams, Cots & Equipment :  City of Cape Town"
282,212,17142,17144,17143,13613,Baby pool,Baby splash pool,150.0,olx|mea|za|853|856,Kids & Baby,"Prams, Cots & Equipment",Unknown, City of Cape Town,"Prams, Cots & Equipment :  City of Cape Town"
283,240,18948,18950,18949,14825,Cot baby - toddler,"White wooden cot 
From baby - toddler
Detachable side as per picture
With matress",1250.0,olx|mea|za|853|856,Kids & Baby,"Prams, Cots & Equipment",Unknown, City of Cape Town,"Prams, Cots & Equipment :  City of Cape Town"
284,241,19041,19043,19042,14890,second hand chelino carseat,Its a bit faded and torn on side but works..,250.0,olx|mea|za|853|856,Kids & Baby,"Prams, Cots & Equipment",Unknown, City of Cape Town,"Prams, Cots & Equipment :  City of Cape Town"
285,250,19926,19928,19927,4522,black scooter,For viewing mail Sms whtsapp Susan,100.0,olx|mea|za|853|856,Kids & Baby,"Prams, Cots & Equipment",Unknown, City of Cape Town,"Prams, Cots & Equipment :  City of Cape Town"
286,276,21638,21640,21639,16647,Camp cot R250,"Used camp cot for sale...yes it was used ...come and view...giveaway prize my baby is now to big for it

Whtapp me on 0715054251",250.0,olx|mea|za|853|856,Kids & Baby,"Prams, Cots & Equipment",Unknown, City of Cape Town,"Prams, Cots & Equipment :  City of Cape Town"
287,278,21856,21858,21857,16791,High Chair,"This one is just ingenious! It can be used as a high chair to avoid food wars during feeding time (for younger babies) and can also be used as a stand alone table and chair (when baby is older). It is incredibly solid and comfortable.

Call or whatsapp i",500.0,olx|mea|za|853|856,Kids & Baby,"Prams, Cots & Equipment",Unknown, City of Cape Town,"Prams, Cots & Equipment :  City of Cape Town"
288,289,22611,22613,22612,17264,baby clothes black bag for sale,black bag full of girls clothes and shoes they are in a very good condition. sizes from prem to 6-12 months. if interested please email,500.0,olx|mea|za|853|855,Kids & Baby,Toddler's Clothing & Accessories,Unknown, City of Cape Town,Toddler's Clothing & Accessories :  City of Cape Town
289,297,23668,23670,23669,4522,black scooter in excellent condition,For viewing Sms phone whtsapp Susan as I do not check my mails that often,120.0,olx|mea|za|853|856,Kids & Baby,"Prams, Cots & Equipment",Unknown, City of Cape Town,"Prams, Cots & Equipment :  City of Cape Town"
290,300,24021,24023,24022,18162,Baby eating and sitting chair very good condition. Used only once. Go,Used once.  Very good condition.,650.0,olx|mea|za|853|856,Kids & Baby,"Prams, Cots & Equipment",Unknown, City of Cape Town,"Prams, Cots & Equipment :  City of Cape Town"
291,301,24097,24099,24098,18209,Denim woolworths baby nappy bag R150,Denim Woolworths baby nappy bag for sale.,150.0,olx|mea|za|853|856,Kids & Baby,"Prams, Cots & Equipment",Unknown, City of Cape Town,"Prams, Cots & Equipment :  City of Cape Town"
292,305,24295,24297,24296,18322,Second hand Baby Girl Clothing,"Second hand girl clothing.
Well looked after.
New infant shoes size O and 1
Age groups 0-3 3-6 6-9/12
More pics available.",10.0,olx|mea|za|853|855,Kids & Baby,Toddler's Clothing & Accessories,Unknown, City of Cape Town,Toddler's Clothing & Accessories :  City of Cape Town
293,319,25404,25406,25405,19007,camping cot,"brand new large  tec take camping cot with two levels . entry way as well as changing mat for sale. lockable wheel and cover bag
If interested contact me on 0730839110  Bargain at R550.00
This cot cost more than R1000.00",550.0,olx|mea|za|853|856,Kids & Baby,"Prams, Cots & Equipment",Unknown, City of Cape Town,"Prams, Cots & Equipment :  City of Cape Town"
294,339,26897,26899,26898,12698,Babe cot top changer,Solid wood baby cot top changer. Never been used. Still has original bix,400.0,olx|mea|za|853|856,Kids & Baby,"Prams, Cots & Equipment",Unknown, City of Cape Town,"Prams, Cots & Equipment :  City of Cape Town"
295,350,28279,28281,28280,20842,Baby feeding chair foldable,Blue foldable feedung chair. Great for small spaces and camping. New R280. My price R150. Still perfect condition.,150.0,olx|mea|za|853|856,Kids & Baby,"Prams, Cots & Equipment",Unknown, City of Cape Town,"Prams, Cots & Equipment :  City of Cape Town"
