,level_0,index,Index,item_id,seller_id,listing_title,listing_description,listing_price,category_sk,category_l1_name_en,category_l2_name_en,category_l3_name_en,Final_Area,Key
144,337,26799,26801,26800,18387,Baby Nursery Decor,Perfect decor for a neutral nursery. Two canvas frames and wall stickers that have not been used. All from Mr Price Home and the same theme and colour.,150.0,olx|mea|za|853|856,Kids & Baby,"Prams, Cots & Equipment",Unknown, City of Johannesburg Metropolitan Municipality,"Prams, Cots & Equipment :  City of Johannesburg Metropolitan Municipality"
145,338,26856,26858,26857,19950,Brand New Heart Frames,Brand New Heart Frames,45.0,olx|mea|za|853|855,Kids & Baby,Toddler's Clothing & Accessories,Unknown, City of Johannesburg Metropolitan Municipality,Toddler's Clothing & Accessories :  City of Johannesburg Metropolitan Municipality
146,341,27172,27174,27173,20160,Nursing pillow,Blue nursing pillow,100.0,olx|mea|za|853|856,Kids & Baby,"Prams, Cots & Equipment",Unknown, City of Johannesburg Metropolitan Municipality,"Prams, Cots & Equipment :  City of Johannesburg Metropolitan Municipality"
147,346,27912,27914,27913,13115,12 to 18 moth toddler girls clothing,"23 items for sale, can be collected in Randburg during the week or Alberton and Jhb South on the weekends.",300.0,olx|mea|za|853|855,Kids & Baby,Toddler's Clothing & Accessories,Unknown, City of Johannesburg Metropolitan Municipality,Toddler's Clothing & Accessories :  City of Johannesburg Metropolitan Municipality
148,353,28615,28617,28616,21051,Camping Cot,"Like new
Mosquito Net
Insert layer for newborns
Additional toy storage tray
Compact once folded",1000.0,olx|mea|za|853|855,Kids & Baby,Toddler's Clothing & Accessories,Unknown, City of Johannesburg Metropolitan Municipality,Toddler's Clothing & Accessories :  City of Johannesburg Metropolitan Municipality
149,355,28781,28783,28782,21152,Angelcare monitor,Angel care monitor in great working condition,200.0,olx|mea|za|853|856,Kids & Baby,"Prams, Cots & Equipment",Unknown, City of Johannesburg Metropolitan Municipality,"Prams, Cots & Equipment :  City of Johannesburg Metropolitan Municipality"
150,356,28837,28839,28838,13427,Various Baby Toys,Various baby toys in good condition.,300.0,olx|mea|za|853|856,Kids & Baby,"Prams, Cots & Equipment",Unknown, City of Johannesburg Metropolitan Municipality,"Prams, Cots & Equipment :  City of Johannesburg Metropolitan Municipality"
151,359,29109,29111,29110,21350,Pram and infant seat,Chelino urban detour,1000.0,olx|mea|za|853|856,Kids & Baby,"Prams, Cots & Equipment",Unknown, City of Johannesburg Metropolitan Municipality,"Prams, Cots & Equipment :  City of Johannesburg Metropolitan Municipality"
152,362,29311,29313,29312,21463,mirror for rear facing car seat,"Diono baby mirror for rear facing car seat , retails for R259.99 looking for R150 Neg",150.0,olx|mea|za|853|856,Kids & Baby,"Prams, Cots & Equipment",Unknown, City of Johannesburg Metropolitan Municipality,"Prams, Cots & Equipment :  City of Johannesburg Metropolitan Municipality"
153,367,29686,29688,29687,21708,250 items baby clothes,"From 3m. Upward to 3years . . Girl mix with boy clothes (no bib,no sock) few veas only )  vall of 250 items for R1100.  All good condition. 0603009747",1100.0,olx|mea|za|853|855,Kids & Baby,Toddler's Clothing & Accessories,Unknown, City of Johannesburg Metropolitan Municipality,Toddler's Clothing & Accessories :  City of Johannesburg Metropolitan Municipality
154,377,30267,30269,30268,22035,Play mat set,"play mat in original packaging, excellent condition, R500 or closest offer. thanks
able to meet in west rand or auckland park.",500.0,olx|mea|za|853|856,Kids & Baby,"Prams, Cots & Equipment",Unknown, City of Johannesburg Metropolitan Municipality,"Prams, Cots & Equipment :  City of Johannesburg Metropolitan Municipality"
155,378,30291,30293,30292,22050,Good quality pram,Good quality pram. Good condition.,1400.0,olx|mea|za|853|856,Kids & Baby,"Prams, Cots & Equipment",Unknown, City of Johannesburg Metropolitan Municipality,"Prams, Cots & Equipment :  City of Johannesburg Metropolitan Municipality"
156,379,30396,30398,30397,22112,"hello im selling my staff ASAP,price neg","very good condition,im selling bcoz im relocating,prices are neg",500.0,olx|mea|za|853|856,Kids & Baby,"Prams, Cots & Equipment",Unknown, City of Johannesburg Metropolitan Municipality,"Prams, Cots & Equipment :  City of Johannesburg Metropolitan Municipality"
157,381,30472,30474,30473,11490,Baby tummy time mat,"This baby mat was a gift that was unfortunately give after my boy was already walking. It is in perfect condition. 
It has a toy with interchangeable animal heads that runs back and forth on a track and plays music. It comes with a support cushion and rol",400.0,olx|mea|za|853|856,Kids & Baby,"Prams, Cots & Equipment",Unknown, City of Johannesburg Metropolitan Municipality,"Prams, Cots & Equipment :  City of Johannesburg Metropolitan Municipality"
158,388,30788,30790,30789,22340,New jungle gym R12500.00 Free delivery and Installation,"4 x [ 1.2m x 1.2m] platforms, 2 x [ wooden roofs] , chain bridge, double drums tunnel, double swings, tyre tower, tyre ladder, pole ladder, Slide, and fireman pole

We move and restore jungle gyms",12500.0,olx|mea|za|853|856,Kids & Baby,"Prams, Cots & Equipment",Unknown, City of Johannesburg Metropolitan Municipality,"Prams, Cots & Equipment :  City of Johannesburg Metropolitan Municipality"
159,390,30941,30943,30942,22421,Bambino child car seat 15-36kg,Very good condition and clean,800.0,olx|mea|za|853|856,Kids & Baby,"Prams, Cots & Equipment",Unknown, City of Johannesburg Metropolitan Municipality,"Prams, Cots & Equipment :  City of Johannesburg Metropolitan Municipality"
160,398,31548,31550,31549,22765,New clothes for 1year pram walking ring,Girls clothes,500.0,olx|mea|za|853|855,Kids & Baby,Toddler's Clothing & Accessories,Unknown, City of Johannesburg Metropolitan Municipality,Toddler's Clothing & Accessories :  City of Johannesburg Metropolitan Municipality
161,403,31841,31843,31842,560,Video baby monitor,"Wireless Colour Handheld video monitor.
Second hand and in excellent condition, cash on delivery.",900.0,olx|mea|za|853|856,Kids & Baby,"Prams, Cots & Equipment",Unknown, City of Johannesburg Metropolitan Municipality,"Prams, Cots & Equipment :  City of Johannesburg Metropolitan Municipality"
162,404,31952,31954,31953,22990,Various,"1. Skidz activity box (Most items are there) R200 (Value R590) 0 - 6 Months.
2. Owl pillow (Roughly 60cm to 80cm) R200
3. Stokke Maxi Cosi Adapters R150
4. Handmade (Erfenis) Leather Shoes (Newborn, 6 Months, 12 Months and 18-24 Months) Measurements ava",350.0,olx|mea|za|853|855,Kids & Baby,Toddler's Clothing & Accessories,Unknown, City of Johannesburg Metropolitan Municipality,Toddler's Clothing & Accessories :  City of Johannesburg Metropolitan Municipality
163,410,32208,32210,32209,23138,R1150-Peg prego feeding chair and cot cum cradle,Good price and in good condition. Interested buyers only contact,1150.0,olx|mea|za|853|856,Kids & Baby,"Prams, Cots & Equipment",Unknown, City of Johannesburg Metropolitan Municipality,"Prams, Cots & Equipment :  City of Johannesburg Metropolitan Municipality"
164,412,32327,32329,32328,10294,2-3 yr girl winter bundle,"3 x winter vests 
2 x polar necks 
1x summer dress 
1x hello kitty hat
1x jersey 
1x tracksuit top 
1x gum boots

Have been well worn by toddler but in fair condition, no holes etc.",70.0,olx|mea|za|853|855,Kids & Baby,Toddler's Clothing & Accessories,Unknown, City of Johannesburg Metropolitan Municipality,Toddler's Clothing & Accessories :  City of Johannesburg Metropolitan Municipality
165,420,33020,33022,33021,23603,Travel System Combo,Graco Pram with baby carrier/ car seat +  car seat up to 18kg as good as new hardly used,1800.0,olx|mea|za|853|856,Kids & Baby,"Prams, Cots & Equipment",Unknown, City of Johannesburg Metropolitan Municipality,"Prams, Cots & Equipment :  City of Johannesburg Metropolitan Municipality"
166,424,33110,33112,33111,23655,Graco Baby Pram,"Baby Pram, Car chair and Isofix.  Great condition. Navy blue colour. 3 years old. 
R2000
Call Shanna 0769112343",2000.0,olx|mea|za|853|856,Kids & Baby,"Prams, Cots & Equipment",Unknown, City of Johannesburg Metropolitan Municipality,"Prams, Cots & Equipment :  City of Johannesburg Metropolitan Municipality"
167,432,33630,33632,33631,23935,Stroller,Baby stroller,180.0,olx|mea|za|853|856,Kids & Baby,"Prams, Cots & Equipment",Unknown, City of Johannesburg Metropolitan Municipality,"Prams, Cots & Equipment :  City of Johannesburg Metropolitan Municipality"
168,433,33871,33873,33872,24076,Bunk Bed For Sale,Steel bunk bed with mattress for sale.  Top bunk bed is single bottom bunk bed is double.,1500.0,olx|mea|za|853|856,Kids & Baby,"Prams, Cots & Equipment",Unknown, City of Johannesburg Metropolitan Municipality,"Prams, Cots & Equipment :  City of Johannesburg Metropolitan Municipality"
169,447,34671,34673,34672,24536,Baby Play Gym,Baby Play Gym,175.0,olx|mea|za|853|856,Kids & Baby,"Prams, Cots & Equipment",Unknown, City of Johannesburg Metropolitan Municipality,"Prams, Cots & Equipment :  City of Johannesburg Metropolitan Municipality"
170,455,35237,35239,35238,7854,Medela - Mini Electric Breastpump,"Medela - Mini Electric Breastpump, good condition, hardly used.",450.0,olx|mea|za|853|856,Kids & Baby,"Prams, Cots & Equipment",Unknown, City of Johannesburg Metropolitan Municipality,"Prams, Cots & Equipment :  City of Johannesburg Metropolitan Municipality"
171,470,35843,35845,35844,25233,Comfort Harmony Electric musical baby swing for sale,Comfort Harmony Electric musical baby swing for sale,500.0,olx|mea|za|853|856,Kids & Baby,"Prams, Cots & Equipment",Unknown, City of Johannesburg Metropolitan Municipality,"Prams, Cots & Equipment :  City of Johannesburg Metropolitan Municipality"
172,473,36075,36077,36076,595,Awesome Chelino 0-18kg car chair available,"I have an Awesome Chelino 0-18kg car chair available 

Newborn to 4 years 

Used but in very good condition 

Only R550

Collection in Roodepoort with cash",550.0,olx|mea|za|853|856,Kids & Baby,"Prams, Cots & Equipment",Unknown, City of Johannesburg Metropolitan Municipality,"Prams, Cots & Equipment :  City of Johannesburg Metropolitan Municipality"
173,486,36957,36959,36958,25233,Comfort Harmony electric Musical baby swing in a good condition,Comfort Harmony electric Musical baby swing in a good condition for sale.,500.0,olx|mea|za|853|856,Kids & Baby,"Prams, Cots & Equipment",Unknown, City of Johannesburg Metropolitan Municipality,"Prams, Cots & Equipment :  City of Johannesburg Metropolitan Municipality"
174,487,37170,37172,37171,595,Lime green Bumbo seat available with belts,"Lime green Bumbo seat available with belts. 

Lightly used and in near perfect condition. 

R250

Collection in Roodepoort with cash",250.0,olx|mea|za|853|856,Kids & Baby,"Prams, Cots & Equipment",Unknown, City of Johannesburg Metropolitan Municipality,"Prams, Cots & Equipment :  City of Johannesburg Metropolitan Municipality"
175,498,37628,37630,37629,26225,Baby cot,"Excellent condition baby cot. Can open side and use as co sleeper, then toddler bed.",1200.0,olx|mea|za|853|855,Kids & Baby,Toddler's Clothing & Accessories,Unknown, City of Johannesburg Metropolitan Municipality,Toddler's Clothing & Accessories :  City of Johannesburg Metropolitan Municipality
176,3,500,500,500,490,Baby pram,Nice varking,1000.0,olx|mea|za|853|856,Kids & Baby,"Prams, Cots & Equipment",Unknown, City of Tshwane Metropolitan Municipality,"Prams, Cots & Equipment :  City of Tshwane Metropolitan Municipality"
177,8,1039,1039,1039,1011,Baby stroller for sale.,Practically new baby stroller for sale. Very good condition.,800.0,olx|mea|za|853|856,Kids & Baby,"Prams, Cots & Equipment",Unknown, City of Tshwane Metropolitan Municipality,"Prams, Cots & Equipment :  City of Tshwane Metropolitan Municipality"
178,20,1887,1887,1887,1793,Graco pram for sale,"Graco 4 wheel pram for sale.

Cup holder that goes over the front included (just not part of pictures)",1000.0,olx|mea|za|853|856,Kids & Baby,"Prams, Cots & Equipment",Unknown, City of Tshwane Metropolitan Municipality,"Prams, Cots & Equipment :  City of Tshwane Metropolitan Municipality"
179,26,2356,2356,2356,430,Left foot SIZE 10,Size 10 foot,1000000000000.0,olx|mea|za|853|855,Kids & Baby,Toddler's Clothing & Accessories,Unknown, City of Tshwane Metropolitan Municipality,Toddler's Clothing & Accessories :  City of Tshwane Metropolitan Municipality
180,28,2473,2473,2473,2324,Wireless Baby Monitor,Babecom Wireless monitor. Good working conditions with rechargeable batteries,350.0,olx|mea|za|853|856,Kids & Baby,"Prams, Cots & Equipment",Unknown, City of Tshwane Metropolitan Municipality,"Prams, Cots & Equipment :  City of Tshwane Metropolitan Municipality"
181,33,2784,2784,2784,2604,Bby twin seat,Secondhand baby seats,750.0,olx|mea|za|853|855,Kids & Baby,Toddler's Clothing & Accessories,Unknown, City of Tshwane Metropolitan Municipality,Toddler's Clothing & Accessories :  City of Tshwane Metropolitan Municipality
182,35,2889,2889,2889,2696,Baby hanging crib,Baby strong hanging crib,400.0,olx|mea|za|853|856,Kids & Baby,"Prams, Cots & Equipment",Unknown, City of Tshwane Metropolitan Municipality,"Prams, Cots & Equipment :  City of Tshwane Metropolitan Municipality"
183,39,3200,3200,3200,1502,Tommee Tippee Electric Breast Pump,"We have an electric breast pump set from Tommy Tippee for sale.
Original price was R999.
Set was hardly used.
Contains all original content except for the 150ml bottle and milk storage pot.",450.0,olx|mea|za|853|856,Kids & Baby,"Prams, Cots & Equipment",Unknown, City of Tshwane Metropolitan Municipality,"Prams, Cots & Equipment :  City of Tshwane Metropolitan Municipality"
184,43,3507,3507,3507,3220,Baby Camping Cot with Matress,Baby camping cot with matress in good condition. Price is R 450. Contact Andre in Centurion on 082 492 6836.,450.0,olx|mea|za|853|856,Kids & Baby,"Prams, Cots & Equipment",Unknown, City of Tshwane Metropolitan Municipality,"Prams, Cots & Equipment :  City of Tshwane Metropolitan Municipality"
185,44,3552,3552,3552,3259,Compactum,Compactum bath & cupboard unit. Bath is removable for emptying & cleaning. Top surface used as changing area. Cupboard has hanging rail & can be used for general storage as well. Currently pink but can be painted any colour by buyer.,1000.0,olx|mea|za|853|856,Kids & Baby,"Prams, Cots & Equipment",Unknown, City of Tshwane Metropolitan Municipality,"Prams, Cots & Equipment :  City of Tshwane Metropolitan Municipality"
186,47,4065,4065,4065,3691,Girls clothes. 3 - 6 months.,Girls clothes. 3 - 6 months. R200 for all of it.,200.0,olx|mea|za|853|855,Kids & Baby,Toddler's Clothing & Accessories,Unknown, City of Tshwane Metropolitan Municipality,Toddler's Clothing & Accessories :  City of Tshwane Metropolitan Municipality
187,49,4277,4277,4277,3874,Bounce baby set,"5 in 1 bounce baby pram , car seat, and all.",1300.0,olx|mea|za|853|856,Kids & Baby,"Prams, Cots & Equipment",Unknown, City of Tshwane Metropolitan Municipality,"Prams, Cots & Equipment :  City of Tshwane Metropolitan Municipality"
188,52,4531,4531,4531,4094,Ingenuity soothe & delight portable swing,Excellent condition only used a few times,800.0,olx|mea|za|853|856,Kids & Baby,"Prams, Cots & Equipment",Unknown, City of Tshwane Metropolitan Municipality,"Prams, Cots & Equipment :  City of Tshwane Metropolitan Municipality"
189,53,4596,4596,4596,4150,Safeway Titan Angelwings Car Seat,"Used Car seat

Group 1, 2 and 3

9 â 36 kg (approx 8 months â 12 years)

Adjustable head support

Side protection with ""AngelWings""

Forward facing only

5-point harness

Easy to install, secure lock device

Energy absorbing EPS foam.

Converts to boos",800.0,olx|mea|za|853|856,Kids & Baby,"Prams, Cots & Equipment",Unknown, City of Tshwane Metropolitan Municipality,"Prams, Cots & Equipment :  City of Tshwane Metropolitan Municipality"
190,74,5787,5787,5787,5142,Baby carry chair (New born),Baby carry chair (New Born to about 5kg)  Can also use as a chair in car,200.0,olx|mea|za|853|856,Kids & Baby,"Prams, Cots & Equipment",Unknown, City of Tshwane Metropolitan Municipality,"Prams, Cots & Equipment :  City of Tshwane Metropolitan Municipality"
191,81,6799,6799,6799,5955,Breast Pump,"Second hand Medela Swing Maxi breast pump for sale. Very good condition. Only used for 4 months.
Includes:
1 x Swing maxi motor unit.
2 x Big bottles
2 x Small bottles
2 x Breastshields
2 x Freestyle connectors
4 x Calma multi lids
1 x Bottle stand",2800.0,olx|mea|za|853|856,Kids & Baby,"Prams, Cots & Equipment",Unknown, City of Tshwane Metropolitan Municipality,"Prams, Cots & Equipment :  City of Tshwane Metropolitan Municipality"
192,95,7539,7539,7539,6555,Winnie the pooh stroller,Baby stroller to sell,123.0,olx|mea|za|853|856,Kids & Baby,"Prams, Cots & Equipment",Unknown, City of Tshwane Metropolitan Municipality,"Prams, Cots & Equipment :  City of Tshwane Metropolitan Municipality"
193,96,7553,7553,7553,5779,"Tiny love cot mobile, brand new never used",Still in box never used,900.0,olx|mea|za|853|856,Kids & Baby,"Prams, Cots & Equipment",Unknown, City of Tshwane Metropolitan Municipality,"Prams, Cots & Equipment :  City of Tshwane Metropolitan Municipality"
194,102,8109,8109,8109,7012,Baby Name Numerology Services,"My name is Chris. I am an intuitive, spiritual guide and spiritual numerologist. As spiritual numerologist I have 15 (fifteen) years experience.

I have a blog that is running and I mostly keep in contact with all my clients through email and Whatsapp bo",144.0,olx|mea|za|853|855,Kids & Baby,Toddler's Clothing & Accessories,Unknown, City of Tshwane Metropolitan Municipality,Toddler's Clothing & Accessories :  City of Tshwane Metropolitan Municipality
195,107,8501,8501,8501,7329,Carrycot,This carrycot is a safe place to put baby down for a nap and easy to carry baby with you in and around the house. Ideal to use when on holiday or visiting friends. Great to put baby inside when practising to sit. Hardly ever used.,400.0,olx|mea|za|853|856,Kids & Baby,"Prams, Cots & Equipment",Unknown, City of Tshwane Metropolitan Municipality,"Prams, Cots & Equipment :  City of Tshwane Metropolitan Municipality"
196,111,9091,9091,9091,7780,A NEW Chelino Tandem Stroller - Blue and Green(Twin Stroller),"A NEW Chelino Tandem Stroller - Blue and Green for sale.
We bought this pram on the 27/March/2017 is still in the Box.For more info whatsup or call 0813213209",2800.0,olx|mea|za|853|856,Kids & Baby,"Prams, Cots & Equipment",Unknown, City of Tshwane Metropolitan Municipality,"Prams, Cots & Equipment :  City of Tshwane Metropolitan Municipality"
197,117,9429,9429,9429,8039,Chelino pram and car seat,"Chelino pram and car seat,good condition. Not using anymorw",800.0,olx|mea|za|853|856,Kids & Baby,"Prams, Cots & Equipment",Unknown, City of Tshwane Metropolitan Municipality,"Prams, Cots & Equipment :  City of Tshwane Metropolitan Municipality"
198,122,9735,9735,9735,8282,Kids Bed,Children double corner bed with homework desk,6000.0,olx|mea|za|853|856,Kids & Baby,"Prams, Cots & Equipment",Unknown, City of Tshwane Metropolitan Municipality,"Prams, Cots & Equipment :  City of Tshwane Metropolitan Municipality"
199,123,9782,9782,9782,8316,3in1 babyrocker for sale,very good condition.,400.0,olx|mea|za|853|856,Kids & Baby,"Prams, Cots & Equipment",Unknown, City of Tshwane Metropolitan Municipality,"Prams, Cots & Equipment :  City of Tshwane Metropolitan Municipality"
200,124,10039,10039,10039,8514,Graco deluxe travel system,Graco Quattro Deluxe Travel System for sale This pram comes with a car seat that fits into the pram. The car seat clips into the pram making it perfect for an infant. The pram has a display which shows you the time and the temperature. It is in a good cond,2000.0,olx|mea|za|853|856,Kids & Baby,"Prams, Cots & Equipment",Unknown, City of Tshwane Metropolitan Municipality,"Prams, Cots & Equipment :  City of Tshwane Metropolitan Municipality"
201,129,10725,10725,10725,9024,Baby strall for sale,Make an offer. It's still new. Was used for six months,1500.0,olx|mea|za|853|856,Kids & Baby,"Prams, Cots & Equipment",Unknown, City of Tshwane Metropolitan Municipality,"Prams, Cots & Equipment :  City of Tshwane Metropolitan Municipality"
202,143,12268,12270,12269,10179,Toddler swing,Toddler swing by Hedstrom.,400.0,olx|mea|za|853|856,Kids & Baby,"Prams, Cots & Equipment",Unknown, City of Tshwane Metropolitan Municipality,"Prams, Cots & Equipment :  City of Tshwane Metropolitan Municipality"
203,147,12442,12444,12443,10306,Branded baby girl Clothes,Lots of branded baby girl clothes. Prices and sizes on photos.  I also have boys and maternity clothes.,50.0,olx|mea|za|853|855,Kids & Baby,Toddler's Clothing & Accessories,Unknown, City of Tshwane Metropolitan Municipality,Toddler's Clothing & Accessories :  City of Tshwane Metropolitan Municipality
204,157,13325,13327,13326,10934,Compressor nebulizer,Compressor nebulizer. Complete nebulizer kit. Good condition.,250.0,olx|mea|za|853|856,Kids & Baby,"Prams, Cots & Equipment",Unknown, City of Tshwane Metropolitan Municipality,"Prams, Cots & Equipment :  City of Tshwane Metropolitan Municipality"
205,162,13727,13729,13728,8442,AngelCare monitor set,"3 peace AngelCare Monitor.

Includes a heart detector pad",750.0,olx|mea|za|853|856,Kids & Baby,"Prams, Cots & Equipment",Unknown, City of Tshwane Metropolitan Municipality,"Prams, Cots & Equipment :  City of Tshwane Metropolitan Municipality"
206,164,13806,13808,13807,11279,Diaper dispenser,Diaper champ diaper dispenser,100.0,olx|mea|za|853|856,Kids & Baby,"Prams, Cots & Equipment",Unknown, City of Tshwane Metropolitan Municipality,"Prams, Cots & Equipment :  City of Tshwane Metropolitan Municipality"
207,170,14316,14318,14317,11646,New Medela bustier (white) size Large,Brand new Medela bustier still in box.,350.0,olx|mea|za|853|856,Kids & Baby,"Prams, Cots & Equipment",Unknown, City of Tshwane Metropolitan Municipality,"Prams, Cots & Equipment :  City of Tshwane Metropolitan Municipality"
208,171,14346,14348,14347,11669,Zonic Baby camping cot,Camping cot. Used by 3 babies.,200.0,olx|mea|za|853|856,Kids & Baby,"Prams, Cots & Equipment",Unknown, City of Tshwane Metropolitan Municipality,"Prams, Cots & Equipment :  City of Tshwane Metropolitan Municipality"
209,175,14553,14555,14554,11820,Tiny Love Mobile,"Tiny Love Mobile, in working condition",80.0,olx|mea|za|853|856,Kids & Baby,"Prams, Cots & Equipment",Unknown, City of Tshwane Metropolitan Municipality,"Prams, Cots & Equipment :  City of Tshwane Metropolitan Municipality"
210,182,14870,14872,14871,12047,Baba kot,Goeie kondisie,1500.0,olx|mea|za|853|856,Kids & Baby,"Prams, Cots & Equipment",Unknown, City of Tshwane Metropolitan Municipality,"Prams, Cots & Equipment :  City of Tshwane Metropolitan Municipality"
211,184,14968,14970,14969,12113,Baby Items,"Feeding chair - R350
Camp cot (no mattress) - R250
A-frame with toys - R150
Pooh vibrating bouncer - R400
Chelino rear facing car seat - R350
Or R850 for everything negotiable",850.0,olx|mea|za|853|856,Kids & Baby,"Prams, Cots & Equipment",Unknown, City of Tshwane Metropolitan Municipality,"Prams, Cots & Equipment :  City of Tshwane Metropolitan Municipality"
212,185,14976,14978,14977,12120,sharpei puppy,ek het opreg sharpei puppy te Koop dus n reuntjie hy is 9 weke oud kn my whatsap vir meer inligting dankie 0611383227,600.0,olx|mea|za|853|855,Kids & Baby,Toddler's Clothing & Accessories,Unknown, City of Tshwane Metropolitan Municipality,Toddler's Clothing & Accessories :  City of Tshwane Metropolitan Municipality
213,186,15076,15078,15077,12193,High baby chair and bumbo combo,Good condition,1000.0,olx|mea|za|853|856,Kids & Baby,"Prams, Cots & Equipment",Unknown, City of Tshwane Metropolitan Municipality,"Prams, Cots & Equipment :  City of Tshwane Metropolitan Municipality"
214,202,16178,16180,16179,12943,Breast pump,"Medela swing (single breast) as good as new with various extras included and also 2 sizes flanges. Used for less than a month. If you buy them brand new they are over R 3000 I want R 1700.

Tommee tippee manual pump NEVER been used. I want R 500.

If y",123.0,olx|mea|za|853|856,Kids & Baby,"Prams, Cots & Equipment",Unknown, City of Tshwane Metropolitan Municipality,"Prams, Cots & Equipment :  City of Tshwane Metropolitan Municipality"
215,207,16728,16730,16729,13329,Personal GPS Tracking for Kids,"GPS Tracking Service for  LGTS APKTracker +  E-drive user account in Platform

APKTracker is software to change Android Smart-phone/Tablet into GPS tracker.
Service is dedicated for personal use on Android device(smartphone, tablet, car audi with maxima",742.0,olx|mea|za|853|855,Kids & Baby,Toddler's Clothing & Accessories,Unknown, City of Tshwane Metropolitan Municipality,Toddler's Clothing & Accessories :  City of Tshwane Metropolitan Municipality
216,211,17128,17130,17129,13606,Maple melamine cot and matching compactum new,Maple melamine cot and matching compactum,6500.0,olx|mea|za|853|856,Kids & Baby,"Prams, Cots & Equipment",Unknown, City of Tshwane Metropolitan Municipality,"Prams, Cots & Equipment :  City of Tshwane Metropolitan Municipality"
