,level_0,index,Index,item_id,seller_id,listing_title,listing_description,listing_price,category_sk,category_l1_name_en,category_l2_name_en,category_l3_name_en,Final_Area,Key
296,360,29117,29119,29118,21354,Toddler 2in1 High Chair,Chelino 2in1 feeding high chair. Converts to separate chair and table for play. Excellent condition. R550,550.0,olx|mea|za|853|856,Kids & Baby,"Prams, Cots & Equipment",Unknown, City of Cape Town,"Prams, Cots & Equipment :  City of Cape Town"
297,365,29617,29619,29618,21662,Snuggletime preggie pillow,"Preggie pillow wedge for sale, as new still in plastic. Best comfort while pregnant and can also be used for baby to wedge into their side.",80.0,olx|mea|za|853|855,Kids & Baby,Toddler's Clothing & Accessories,Unknown, City of Cape Town,Toddler's Clothing & Accessories :  City of Cape Town
298,368,29755,29757,29756,21747,Woolworths baby shoes,Woolies mint condition baby girl shoes size 0-2 R50pp,50.0,olx|mea|za|853|855,Kids & Baby,Toddler's Clothing & Accessories,Unknown, City of Cape Town,Toddler's Clothing & Accessories :  City of Cape Town
299,392,30957,30959,30958,22432,Brand new pink,Never been used brand new bic ...2 small 4 my daughter got it as a gift...,350.0,olx|mea|za|853|856,Kids & Baby,"Prams, Cots & Equipment",Unknown, City of Cape Town,"Prams, Cots & Equipment :  City of Cape Town"
300,393,30961,30963,30962,22434,Nido 3,"Hi, I have a tin Nido 3 (Sealed) for sale at R220. If Interested, please call me on 082 784 5124",220.0,olx|mea|za|853|855,Kids & Baby,Toddler's Clothing & Accessories,Unknown, City of Cape Town,Toddler's Clothing & Accessories :  City of Cape Town
301,421,33064,33066,33065,23628,Pram,Chellino pram with carry chair.  Very good condition.,1300.0,olx|mea|za|853|856,Kids & Baby,"Prams, Cots & Equipment",Unknown, City of Cape Town,"Prams, Cots & Equipment :  City of Cape Town"
302,429,33468,33470,33469,23850,AngelCare sounds only monitor,"Brand new AngelCare sounds only monitor. Still sealed in box. Unwanted gift. Retails for R1000, selling for R450.",400.0,olx|mea|za|853|856,Kids & Baby,"Prams, Cots & Equipment",Unknown, City of Cape Town,"Prams, Cots & Equipment :  City of Cape Town"
303,430,33511,33513,33512,4522,baby bath for sale in brand new condition,For viewing Sms phone whtsapp Susan as I do not check my mails that often,100.0,olx|mea|za|853|856,Kids & Baby,"Prams, Cots & Equipment",Unknown, City of Cape Town,"Prams, Cots & Equipment :  City of Cape Town"
304,440,34376,34378,34377,4522,Camping cot on wheels with light and plays tunes,Easy movable. For viewing mail Sms whtsapp Susan,400.0,olx|mea|za|853|856,Kids & Baby,"Prams, Cots & Equipment",Unknown, City of Cape Town,"Prams, Cots & Equipment :  City of Cape Town"
305,444,34566,34568,34567,24483,Variety of girls shoes,"Vans sneakers size 5
Ackermans open sneakers size 5
Woolworths green pumps size 4
Minnie Mouse pokka dot boots size 6
Pink butterfly pumps size 5
Pink sandals size 4
Havaianas Winnie The Pooh Eur size 21",250.0,olx|mea|za|853|855,Kids & Baby,Toddler's Clothing & Accessories,Unknown, City of Cape Town,Toddler's Clothing & Accessories :  City of Cape Town
306,450,34906,34908,34907,24673,Feeding chair converts into table & chair,First come first serve,490.0,olx|mea|za|853|856,Kids & Baby,"Prams, Cots & Equipment",Unknown, City of Cape Town,"Prams, Cots & Equipment :  City of Cape Town"
307,456,35238,35240,35239,24862,Recaro Young Profi Car Seat and Isofix base - birth to 13kg,Both seat and base are in excellent condition.  Seat was only used for about 6 months. The seat can be used with either the isofix base or a seatbelt.  Included are the mounts to connect the seat to a Baby Jogger Citi Mini Stroller.,4000.0,olx|mea|za|853|856,Kids & Baby,"Prams, Cots & Equipment",Unknown, City of Cape Town,"Prams, Cots & Equipment :  City of Cape Town"
308,457,35249,35251,35250,24870,Graco car seat,Graco car seat as new,650.0,olx|mea|za|853|856,Kids & Baby,"Prams, Cots & Equipment",Unknown, City of Cape Town,"Prams, Cots & Equipment :  City of Cape Town"
309,462,35542,35544,35543,25053,Angelcare Nappy Bin with Odour Seal,Includes refill bags. Never used.,200.0,olx|mea|za|853|856,Kids & Baby,"Prams, Cots & Equipment",Unknown, City of Cape Town,"Prams, Cots & Equipment :  City of Cape Town"
310,463,35551,35553,35552,25060,Baby Goodies,"I have a few goodies that I am not using anymore. 

Items are all three years old. 

Denim baby Kangaroo carrier 
Bath ring and sponge
Baby diaper bin 
Baby cot mobile ( fisher Price) 
Baby feeding chair that fits onto table",950.0,olx|mea|za|853|856,Kids & Baby,"Prams, Cots & Equipment",Unknown, City of Cape Town,"Prams, Cots & Equipment :  City of Cape Town"
311,471,36010,36012,36011,25330,Baby shoes 0-6 months,Take all for R 100,100.0,olx|mea|za|853|855,Kids & Baby,Toddler's Clothing & Accessories,Unknown, City of Cape Town,Toddler's Clothing & Accessories :  City of Cape Town
312,492,37501,37503,37502,26160,Chelino pram and Car Chair,"Hi, im selling my Chelino pram and car chair. Please contact me for further details.",1500.0,olx|mea|za|853|856,Kids & Baby,"Prams, Cots & Equipment",Unknown, City of Cape Town,"Prams, Cots & Equipment :  City of Cape Town"
313,11,1252,1252,1252,1215,18-24 months toddler clothing bundle,"Bundle of 18-24 month toddler clothes. Used but in a good condition. Bundle includes the following items:
x6 long sleeve shirts
x1 winter jacket
x1 short sleeve shirt
x1 pair of shoes

Delivery options (additional to advertised price):
* Collect in ",150.0,olx|mea|za|853|855,Kids & Baby,Toddler's Clothing & Accessories,Unknown,Other-SA,Toddler's Clothing & Accessories : Other-SA
314,382,30494,30496,30495,1215,Hooded towels,"Set of boys and girls hooded baby towels for sale.  Used but in a good condition. Price is per set of 3 towels. 

 Delivery options (additional to advertised price):
 * Collect in Witbank
 * Collect in Pretoria East in the Silver Lakes area.
 * Courie",75.0,olx|mea|za|853|855,Kids & Baby,Toddler's Clothing & Accessories,Unknown,Other-SA,Toddler's Clothing & Accessories : Other-SA
315,386,30697,30699,30698,22282,Toddler bed,Toddler  bed  for  sale.  Including  matress.,600.0,olx|mea|za|853|856,Kids & Baby,"Prams, Cots & Equipment",Unknown,Other-SA,"Prams, Cots & Equipment : Other-SA"
316,425,33226,33228,33227,23725,Elephant Onesie,"Afreaka Toddler Elephant Onesie. 3-4yrs. Brand new, never been worn. Retail price is R450.",350.0,olx|mea|za|853|855,Kids & Baby,Toddler's Clothing & Accessories,Unknown,Other-SA,Toddler's Clothing & Accessories : Other-SA
317,15,1536,1536,1536,1261,16 inch Princess bicycle,Never used. A bargain of bargains.call/ WhatsApp Raina 079 715 6015.,999.0,olx|mea|za|853|856,Kids & Baby,"Prams, Cots & Equipment",Unknown, eThekwini Metropolitan Municipality,"Prams, Cots & Equipment :  eThekwini Metropolitan Municipality"
318,19,1861,1861,1861,1769,Brand new bounce pram,"Brand-new bounce pram  R699
Brand new musical walking ring r270

Take both for R899",699.0,olx|mea|za|853|856,Kids & Baby,"Prams, Cots & Equipment",Unknown, eThekwini Metropolitan Municipality,"Prams, Cots & Equipment :  eThekwini Metropolitan Municipality"
319,50,4326,4326,4326,3916,Armani 6/12 months new,baby romper Armani size 6*12 months,200.0,olx|mea|za|853|855,Kids & Baby,Toddler's Clothing & Accessories,Unknown, eThekwini Metropolitan Municipality,Toddler's Clothing & Accessories :  eThekwini Metropolitan Municipality
320,60,4873,4873,4873,4387,minnie mouse bed with mattress,Actual minnie mouse bed with mattress. No pink sides. In good condition. Urgent sale. R1300 or nearest cash offer.,1234.0,olx|mea|za|853|856,Kids & Baby,"Prams, Cots & Equipment",Unknown, eThekwini Metropolitan Municipality,"Prams, Cots & Equipment :  eThekwini Metropolitan Municipality"
321,71,5596,5596,5596,4986,white wood cot,"White wood cot, storage draws below R1650 negotiable.  Also available, toddler feeding chair; car seat and pram, R1500 for these 3 items. Call 0847775730",1650.0,olx|mea|za|853|856,Kids & Baby,"Prams, Cots & Equipment",Unknown, eThekwini Metropolitan Municipality,"Prams, Cots & Equipment :  eThekwini Metropolitan Municipality"
322,80,6703,6703,6703,5882,Hulk Mask & Cape,"Made from good quality cotton and stiffening for mask
Cape size 70cm in length and 80cm wide.. both items are fully washable. (not the throw away kind)
Bev 0832333681",150.0,olx|mea|za|853|855,Kids & Baby,Toddler's Clothing & Accessories,Unknown, eThekwini Metropolitan Municipality,Toddler's Clothing & Accessories :  eThekwini Metropolitan Municipality
323,82,6829,6829,6829,5978,Hi i am selling kids pants,Kids pants brand new for sale 2 items 200 size 5to6,200.0,olx|mea|za|853|856,Kids & Baby,"Prams, Cots & Equipment",Unknown, eThekwini Metropolitan Municipality,"Prams, Cots & Equipment :  eThekwini Metropolitan Municipality"
324,85,6865,6865,6865,6005,Fisher-price potty for ur little one,Very cute potty that plays tunes to let u know if it was a poo or pee that ur little one made..Great condition..URGENT!!,400.0,olx|mea|za|853|856,Kids & Baby,"Prams, Cots & Equipment",Unknown, eThekwini Metropolitan Municipality,"Prams, Cots & Equipment :  eThekwini Metropolitan Municipality"
325,89,7169,7169,7169,6252,Little One Camp Cot,"Little One Camp Coopt,

Good condition all accessories including carry bag.  Can even add two x mattresses ( slightly stained)",700.0,olx|mea|za|853|856,Kids & Baby,"Prams, Cots & Equipment",Unknown, eThekwini Metropolitan Municipality,"Prams, Cots & Equipment :  eThekwini Metropolitan Municipality"
326,92,7350,7350,7350,6399,camp cot,Camp cot with storage bag,50000.0,olx|mea|za|853|856,Kids & Baby,"Prams, Cots & Equipment",Unknown, eThekwini Metropolitan Municipality,"Prams, Cots & Equipment :  eThekwini Metropolitan Municipality"
327,113,9160,9160,9160,4387,minnie mouse bed with mattress,Minnie mouse bed with mattress. No pink sides. In good condition. Urgent sale. R1300 or nearest cash offer,1234.0,olx|mea|za|853|856,Kids & Baby,"Prams, Cots & Equipment",Unknown, eThekwini Metropolitan Municipality,"Prams, Cots & Equipment :  eThekwini Metropolitan Municipality"
328,121,9732,9732,9732,8279,Doll play house,Play house in excellent  condition,600.0,olx|mea|za|853|856,Kids & Baby,"Prams, Cots & Equipment",Unknown, eThekwini Metropolitan Municipality,"Prams, Cots & Equipment :  eThekwini Metropolitan Municipality"
329,132,11002,11002,11002,9234,Mickey Mouse potty,"Mickey Mouse potty. Play music when you flush
Practically new, my son refused to use it. Paid R600, looking for R300",300.0,olx|mea|za|853|856,Kids & Baby,"Prams, Cots & Equipment",Unknown, eThekwini Metropolitan Municipality,"Prams, Cots & Equipment :  eThekwini Metropolitan Municipality"
330,136,11513,11515,11514,9602,Bmw baby car seat (ISOFIX),"Bmw baby car seat with Isofix - hardly used
New price R 6300.00
Wanting R 3500.00",3500.0,olx|mea|za|853|856,Kids & Baby,"Prams, Cots & Equipment",Unknown, eThekwini Metropolitan Municipality,"Prams, Cots & Equipment :  eThekwini Metropolitan Municipality"
331,151,12704,12706,12705,4387,minnie mouse bed with mattress,"Minnie mouse bed with mattress. In a very condition. Urgent sale. R1,500",123.0,olx|mea|za|853|856,Kids & Baby,"Prams, Cots & Equipment",Unknown, eThekwini Metropolitan Municipality,"Prams, Cots & Equipment :  eThekwini Metropolitan Municipality"
332,153,12772,12774,12773,10534,Solid Wood Baby Cot,Baby cot for sale. Includes mattress and all blankets. R950. Phone calls only 0812306391. If you are seeing this ad it is still available.,950.0,olx|mea|za|853|856,Kids & Baby,"Prams, Cots & Equipment",Unknown, eThekwini Metropolitan Municipality,"Prams, Cots & Equipment :  eThekwini Metropolitan Municipality"
333,189,15223,15225,15224,12293,Disney baby walker,"Baby walker in good condition, with nursery rhymes, was used for just under two months",1500.0,olx|mea|za|853|856,Kids & Baby,"Prams, Cots & Equipment",Unknown, eThekwini Metropolitan Municipality,"Prams, Cots & Equipment :  eThekwini Metropolitan Municipality"
334,199,15994,15996,15995,12822,Chelino pram in good condition,Second had chelino pram for sale. Only used for 6 months. Price is neg.,550.0,olx|mea|za|853|856,Kids & Baby,"Prams, Cots & Equipment",Unknown, eThekwini Metropolitan Municipality,"Prams, Cots & Equipment :  eThekwini Metropolitan Municipality"
335,206,16629,16631,16630,4387,minnie mouse bed with mattress,"Minnie mouse bed with mattress. Good condition. Urgent sale. R1,500",123.0,olx|mea|za|853|856,Kids & Baby,"Prams, Cots & Equipment",Unknown, eThekwini Metropolitan Municipality,"Prams, Cots & Equipment :  eThekwini Metropolitan Municipality"
336,214,17296,17298,17297,13716,Baby milk bottles,"2x baby avent milk bottles for sale 
R250 unwanted
CALL: 0839957565",250.0,olx|mea|za|853|855,Kids & Baby,Toddler's Clothing & Accessories,Unknown, eThekwini Metropolitan Municipality,Toddler's Clothing & Accessories :  eThekwini Metropolitan Municipality
337,226,18027,18029,18028,14215,Great gifts for kidz,Character beach towels,140.0,olx|mea|za|853|855,Kids & Baby,Toddler's Clothing & Accessories,Unknown, eThekwini Metropolitan Municipality,Toddler's Clothing & Accessories :  eThekwini Metropolitan Municipality
338,228,18152,18154,18153,14295,Baby stuff,"Chicco pram, Babby carrier, 2car seats, cam coat",1800.0,olx|mea|za|853|856,Kids & Baby,"Prams, Cots & Equipment",Unknown, eThekwini Metropolitan Municipality,"Prams, Cots & Equipment :  eThekwini Metropolitan Municipality"
339,238,18807,18809,18808,14733,Angelcare Movement & Sound Baby Monitor,Angelcare Movement & Sound Baby Monitor - Good Working Condition - Selling as no more use for it - Preferably to collect in Amanzimtoti.,800.0,olx|mea|za|853|856,Kids & Baby,"Prams, Cots & Equipment",Unknown, eThekwini Metropolitan Municipality,"Prams, Cots & Equipment :  eThekwini Metropolitan Municipality"
340,275,21625,21627,21626,16639,"Bargain Bargain!!! Graco Travel System, Campcot + Rocking Chair R1500","Graco Travel System, Capmcot and battery operated rocking chair all for an unbelievable R1500. This is an urgent sale. The travel system is a very good condition. Many accessories included.",1500.0,olx|mea|za|853|856,Kids & Baby,"Prams, Cots & Equipment",Unknown, eThekwini Metropolitan Municipality,"Prams, Cots & Equipment :  eThekwini Metropolitan Municipality"
341,304,24161,24163,24162,18237,Wooden rocking chair,Lovely rocking chair for mom to be.,1100.0,olx|mea|za|853|856,Kids & Baby,"Prams, Cots & Equipment",Unknown, eThekwini Metropolitan Municipality,"Prams, Cots & Equipment :  eThekwini Metropolitan Municipality"
342,306,24333,24335,24334,18348,Chelino camp cot,Hardly used camp cot comes with the mattress and sheet has double level nd a mosquito net,850.0,olx|mea|za|853|856,Kids & Baby,"Prams, Cots & Equipment",Unknown, eThekwini Metropolitan Municipality,"Prams, Cots & Equipment :  eThekwini Metropolitan Municipality"
343,313,24992,24994,24993,18738,Walking ring,Walking ring for girls almost brand new,250.0,olx|mea|za|853|856,Kids & Baby,"Prams, Cots & Equipment",Unknown, eThekwini Metropolitan Municipality,"Prams, Cots & Equipment :  eThekwini Metropolitan Municipality"
344,324,25681,25683,25682,19197,Baby Boy's clothing 6-12 mths,Twin boy clothing various R120 for both. Hardly used,120.0,olx|mea|za|853|855,Kids & Baby,Toddler's Clothing & Accessories,Unknown, eThekwini Metropolitan Municipality,Toddler's Clothing & Accessories :  eThekwini Metropolitan Municipality
345,333,26589,26591,26590,19772,Pram and car seat combo,Pram and car seat both for sale. Good condition selling together.,1000.0,olx|mea|za|853|856,Kids & Baby,"Prams, Cots & Equipment",Unknown, eThekwini Metropolitan Municipality,"Prams, Cots & Equipment :  eThekwini Metropolitan Municipality"
346,334,26631,26633,26632,3916,Camera monitor with sound,Baby camera monitor with sound. Well.used. in working order.,250.0,olx|mea|za|853|855,Kids & Baby,Toddler's Clothing & Accessories,Unknown, eThekwini Metropolitan Municipality,Toddler's Clothing & Accessories :  eThekwini Metropolitan Municipality
347,336,26783,26785,26784,19906,Kids brand new clothes for sale,We have baby items from vest to growers,80.0,olx|mea|za|853|855,Kids & Baby,Toddler's Clothing & Accessories,Unknown, eThekwini Metropolitan Municipality,Toddler's Clothing & Accessories :  eThekwini Metropolitan Municipality
348,349,28062,28064,28063,20719,For Sale: Mahogany Sleigh Cot Excellent Condition,"For Sale: Mahogany Sleigh Cot in Excellent Condition. Price: R3400. Collection: Hillcrest, Durban. Contact: 082 531 4694",3400.0,olx|mea|za|853|856,Kids & Baby,"Prams, Cots & Equipment",Unknown, eThekwini Metropolitan Municipality,"Prams, Cots & Equipment :  eThekwini Metropolitan Municipality"
349,372,29985,29987,29986,21872,Graco Pram and Car seat and Fisher Price Rocker For Sale,"2nd hand baby goods for sale
still in good condition",1500.0,olx|mea|za|853|856,Kids & Baby,"Prams, Cots & Equipment",Unknown, eThekwini Metropolitan Municipality,"Prams, Cots & Equipment :  eThekwini Metropolitan Municipality"
350,380,30405,30407,30406,22119,Leapfrog laptop for kids,New but no box,300.0,olx|mea|za|853|855,Kids & Baby,Toddler's Clothing & Accessories,Unknown, eThekwini Metropolitan Municipality,Toddler's Clothing & Accessories :  eThekwini Metropolitan Municipality
351,389,30850,30852,30851,22376,baby pram in Excellent condition,baby pram in excellent condition .only used twice.asking 600 onco 0732488581,600.0,olx|mea|za|853|856,Kids & Baby,"Prams, Cots & Equipment",Unknown, eThekwini Metropolitan Municipality,"Prams, Cots & Equipment :  eThekwini Metropolitan Municipality"
352,394,30965,30967,30966,10534,Baby High Chair,Baby feeding chair for sale. R350. Phone calls only 0812306391. If you are seeing this ad it is still available.,350.0,olx|mea|za|853|856,Kids & Baby,"Prams, Cots & Equipment",Unknown, eThekwini Metropolitan Municipality,"Prams, Cots & Equipment :  eThekwini Metropolitan Municipality"
353,435,34034,34036,34035,24171,Intex play pen,Neva used great fun for kids 3-18 months,200.0,olx|mea|za|853|856,Kids & Baby,"Prams, Cots & Equipment",Unknown, eThekwini Metropolitan Municipality,"Prams, Cots & Equipment :  eThekwini Metropolitan Municipality"
354,436,34116,34118,34117,24215,White baby compactum,Good condition,1800.0,olx|mea|za|853|856,Kids & Baby,"Prams, Cots & Equipment",Unknown, eThekwini Metropolitan Municipality,"Prams, Cots & Equipment :  eThekwini Metropolitan Municipality"
355,459,35489,35491,35490,25018,baby clothes,"Baby boy clothes jean R60, tshirt R40,1-3 months, body warmer R60, codro pant R40 6-12 months all from woolies, jersey R60 3-6months from edgars, girls shoes size 6 R100 if interested contact 0733460416
gi.",60.0,olx|mea|za|853|855,Kids & Baby,Toddler's Clothing & Accessories,Unknown, eThekwini Metropolitan Municipality,Toddler's Clothing & Accessories :  eThekwini Metropolitan Municipality
356,481,36686,36688,36687,25706,Baby bath tub with stand,Tub has a built-in baby seat can be used on its own or with stand .the stand is still in its plastic packaging,450.0,olx|mea|za|853|856,Kids & Baby,"Prams, Cots & Equipment",Unknown, eThekwini Metropolitan Municipality,"Prams, Cots & Equipment :  eThekwini Metropolitan Municipality"
357,490,37376,37378,37377,26091,"Walking Ring, as new","Walking Ring,in excellent condition, hardly used.  Adjustable heights and plays tunes.
0837013823",300.0,olx|mea|za|853|856,Kids & Baby,"Prams, Cots & Equipment",Unknown, eThekwini Metropolitan Municipality,"Prams, Cots & Equipment :  eThekwini Metropolitan Municipality"
358,16,1697,1697,1697,1625,Baby bAmbo seat,"Purple bAmbo seat
With straps 
200 neg",200.0,olx|mea|za|853|856,Kids & Baby,"Prams, Cots & Equipment",Unknown, Emfuleni Local Municipality,"Prams, Cots & Equipment :  Emfuleni Local Municipality"
359,66,5327,5327,5327,4759,Chelino Travel system,Chelino pram with car seat and base,1600.0,olx|mea|za|853|856,Kids & Baby,"Prams, Cots & Equipment",Unknown, Emfuleni Local Municipality,"Prams, Cots & Equipment :  Emfuleni Local Municipality"
360,70,5499,5499,5499,4908,eating tray,green eating seat.it can tilt back and strap baby in.,800.0,olx|mea|za|853|856,Kids & Baby,"Prams, Cots & Equipment",Unknown, Emfuleni Local Municipality,"Prams, Cots & Equipment :  Emfuleni Local Municipality"
361,84,6838,6838,6838,5985,Wrist Rattles,Rattled for babies,60.0,olx|mea|za|853|855,Kids & Baby,Toddler's Clothing & Accessories,Unknown, Emfuleni Local Municipality,Toddler's Clothing & Accessories :  Emfuleni Local Municipality
362,106,8338,8338,8338,7201,baby stuff with snuggletime baby travel napper**whatsapp doesn't work*,"2 baby bath seats,telament colic drops still sealed,tantol medi moisturising baby lotion, tantol medi baby bum cream,jelly tots brush and comb set,carriwell maternity hospital panties,carriewell maternity pads extra large amd ultra absorbent 12 pads all st",350.0,olx|mea|za|853|856,Kids & Baby,"Prams, Cots & Equipment",Unknown, Emfuleni Local Municipality,"Prams, Cots & Equipment :  Emfuleni Local Municipality"
363,242,19207,19209,19208,15006,Little One Camping Cot,Little One Camping Cot,500.0,olx|mea|za|853|856,Kids & Baby,"Prams, Cots & Equipment",Unknown, Emfuleni Local Municipality,"Prams, Cots & Equipment :  Emfuleni Local Municipality"
364,405,32051,32053,32052,23051,Child bear photographic costume age 1 to 2 years,Child bear photographic costume 1 to 2 year. Hand made. Fully Adjustable Velcro. Soft and child friendly. Ann Geddes inspired.,200.0,olx|mea|za|853|855,Kids & Baby,Toddler's Clothing & Accessories,Unknown, Emfuleni Local Municipality,Toddler's Clothing & Accessories :  Emfuleni Local Municipality
365,441,34382,34384,34383,4908,baby play matt,baby play mat almost new,400.0,olx|mea|za|853|856,Kids & Baby,"Prams, Cots & Equipment",Unknown, Emfuleni Local Municipality,"Prams, Cots & Equipment :  Emfuleni Local Municipality"
366,452,35049,35051,35050,24755,Nearly New Kids Clothing,"Girls clothing.
like new - only worn few times by 1 child.
age newborn to 10 years.
summer and/or winter.
incl all essentials.
price negotiable.
selling for apprx 25% of original value.
minimum sale R1000.",1000.0,olx|mea|za|853|855,Kids & Baby,Toddler's Clothing & Accessories,Unknown, Emfuleni Local Municipality,Toddler's Clothing & Accessories :  Emfuleni Local Municipality
367,469,35823,35825,35824,21479,Nania Car seat,Straps adjustable and can be secured in a car seat for safety. Washable material,250.0,olx|mea|za|853|856,Kids & Baby,"Prams, Cots & Equipment",Unknown, Emfuleni Local Municipality,"Prams, Cots & Equipment :  Emfuleni Local Municipality"
368,477,36340,36342,36341,25526,Beautifull girls dresses,Can be sold seperatly or take all 3 for R150. Only worn once,150.0,olx|mea|za|853|855,Kids & Baby,Toddler's Clothing & Accessories,Unknown, Emfuleni Local Municipality,Toddler's Clothing & Accessories :  Emfuleni Local Municipality
369,17,1706,1706,1706,1632,Chico baby car seat,Chico baby car seat,400.0,olx|mea|za|853|856,Kids & Baby,"Prams, Cots & Equipment",Unknown,Other-SA,"Prams, Cots & Equipment : Other-SA"
370,22,2076,2076,2076,1962,Red baby car seat,It is a red car seat still looking brand new you can negotiate the price and the sell is urgent... I will whatsApp photos if required. 0815045881Elize the picture is just an example,300.0,olx|mea|za|853|856,Kids & Baby,"Prams, Cots & Equipment",Unknown,Other-SA,"Prams, Cots & Equipment : Other-SA"
371,125,10054,10054,10054,8523,Jacket,Black not genuine leather jacket,150.0,olx|mea|za|853|856,Kids & Baby,"Prams, Cots & Equipment",Unknown,Other-SA,"Prams, Cots & Equipment : Other-SA"
372,252,20396,20398,20397,3664,Goodbaby feeding chair,I'm selling this feeding chair still in good condition call me if interested on 0781817140,350.0,olx|mea|za|853|856,Kids & Baby,"Prams, Cots & Equipment",Unknown,Other-SA,"Prams, Cots & Equipment : Other-SA"
373,309,24645,24647,24646,18532,Snookums warmer,Snookums food and bottle warmer,200.0,olx|mea|za|853|856,Kids & Baby,"Prams, Cots & Equipment",Unknown,Other-SA,"Prams, Cots & Equipment : Other-SA"
374,317,25153,25155,25154,18851,Mahogany Sleigh Cot,"I have a sleigh cot in mahogany available.
No mattress.
Cot was used and has a few minor nicks and scratches.",2000.0,olx|mea|za|853|856,Kids & Baby,"Prams, Cots & Equipment",Unknown,Other-SA,"Prams, Cots & Equipment : Other-SA"
375,437,34199,34201,34200,3664,Goodbaby chair and feeding chair,I'm selling my car chair and feeding chair still in excellent  condition call me on 078181 7140,500.0,olx|mea|za|853|856,Kids & Baby,"Prams, Cots & Equipment",Unknown,Other-SA,"Prams, Cots & Equipment : Other-SA"
376,467,35798,35800,35799,25203,Cadii box tas te koop,Box tas te koop in goeie toestand,350.0,olx|mea|za|853|856,Kids & Baby,"Prams, Cots & Equipment",Unknown,Other-SA,"Prams, Cots & Equipment : Other-SA"
377,488,37179,37181,37180,25981,Jeep bsby carrier,"Its jeep baby carrier still in good condition,you can call or send a call back on 079 339 1972",300.0,olx|mea|za|853|856,Kids & Baby,"Prams, Cots & Equipment",Unknown,Other-SA,"Prams, Cots & Equipment : Other-SA"
378,24,2116,2116,2116,1999,Angle care monitor te koop,"Monitor met ""pad"" te koop.",850.0,olx|mea|za|853|856,Kids & Baby,"Prams, Cots & Equipment",Unknown, Mangaung Metropolitan Municipality,"Prams, Cots & Equipment :  Mangaung Metropolitan Municipality"
379,65,5307,5307,5307,4746,3 in 1 cot for sale,3 in 1 kot te koop. Dit haal uitmekaar en raak n enkel bed met n bedkassie,8000.0,olx|mea|za|853|856,Kids & Baby,"Prams, Cots & Equipment",Unknown, Mangaung Metropolitan Municipality,"Prams, Cots & Equipment :  Mangaung Metropolitan Municipality"
